{
  "metadata": {
    "title": "BMC Bolsa Comisionista - Complete Architecture",
    "project_name": "bmc_input",
    "diagram_type": "network",
    "version": "1.0.0",
    "description": "Sistema Regulatorio BMC - 60M productos, 10K facturas/hora",
    "tags": [
      "bmc",
      "regulatorio",
      "dian",
      "colombia",
      "aws"
    ]
  },
  "canvas": {
    "width": 3000,
    "height": 2000,
    "grid_size": 10,
    "background": "white"
  },
  "architecture": {
    "components": [
      {
        "id": "bmc_users",
        "type": "users",
        "label": "BMC Users\\n10K Concurrent\\nRegulatory System",
        "position": {
          "x": 100,
          "y": 150
        },
        "size": {
          "width": 100,
          "height": 80
        },
        "metadata": {
          "capacity": "10000 concurrent users",
          "type": "regulatory_users",
          "region": "Colombia"
        }
      },
      {
        "id": "internet",
        "type": "internet_gateway",
        "label": "Internet\\nHTTPS/TLS 1.3",
        "position": {
          "x": 300,
          "y": 150
        },
        "size": {
          "width": 80,
          "height": 80
        }
      }
    ],
    "containers": [
      {
        "id": "aws_cloud",
        "type": "vpc",
        "label": "AWS Cloud - us-east-1\\nBMC Production Environment",
        "bounds": {
          "x": 50,
          "y": 300,
          "width": 2800,
          "height": 1600
        },
        "children": [
          {
            "id": "edge_security",
            "type": "security_group",
            "label": "Edge & Security Layer",
            "bounds": {
              "x": 100,
              "y": 100,
              "width": 2600,
              "height": 200
            },
            "components": [
              {
                "id": "cloudfront",
                "type": "cloudfront",
                "label": "CloudFront CDN\\nGlobal Edge\\nSSL Termination",
                "position": {
                  "x": 100,
                  "y": 80
                },
                "size": {
                  "width": 120,
                  "height": 100
                }
              },
              {
                "id": "waf",
                "type": "waf",
                "label": "AWS WAF\\nDDoS Protection\\nRate Limiting",
                "position": {
                  "x": 300,
                  "y": 80
                },
                "size": {
                  "width": 120,
                  "height": 100
                }
              },
              {
                "id": "api_gateway",
                "type": "api_gateway",
                "label": "API Gateway\\nREST + GraphQL\\n10K req/sec",
                "position": {
                  "x": 500,
                  "y": 80
                },
                "size": {
                  "width": 120,
                  "height": 100
                },
                "properties": {
                  "throttle_rate": "10000/sec",
                  "burst_limit": "5000"
                }
              },
              {
                "id": "cognito",
                "type": "cognito",
                "label": "Cognito\\nUser Pool\\nMFA Enabled",
                "position": {
                  "x": 700,
                  "y": 80
                },
                "size": {
                  "width": 120,
                  "height": 100
                }
              }
            ]
          },
          {
            "id": "vpc_main",
            "type": "vpc",
            "label": "VPC 10.0.0.0/16\\nBMC Production Network",
            "bounds": {
              "x": 100,
              "y": 350,
              "width": 2600,
              "height": 1200
            },
            "properties": {
              "cidr": "10.0.0.0/16",
              "dns_hostnames": true,
              "flow_logs": true
            },
            "children": [
              {
                "id": "az_a",
                "type": "availability_zone",
                "label": "AZ us-east-1a - Primary",
                "bounds": {
                  "x": 50,
                  "y": 50,
                  "width": 1200,
                  "height": 1100
                },
                "children": [
                  {
                    "id": "public_a",
                    "type": "subnet",
                    "label": "Public Subnet A\\n10.0.1.0/24",
                    "bounds": {
                      "x": 50,
                      "y": 50,
                      "width": 500,
                      "height": 200
                    },
                    "components": [
                      {
                        "id": "alb",
                        "type": "elb",
                        "label": "Application LB\\nMulti-AZ\\nSSL Termination",
                        "position": {
                          "x": 100,
                          "y": 80
                        },
                        "size": {
                          "width": 120,
                          "height": 80
                        }
                      },
                      {
                        "id": "nat_a",
                        "type": "nat_gateway",
                        "label": "NAT Gateway A\\n45 Gbps",
                        "position": {
                          "x": 300,
                          "y": 80
                        },
                        "size": {
                          "width": 100,
                          "height": 80
                        }
                      }
                    ]
                  },
                  {
                    "id": "private_a",
                    "type": "subnet",
                    "label": "Private Subnet A\\n10.0.10.0/24\\nMicroservices Layer",
                    "bounds": {
                      "x": 50,
                      "y": 300,
                      "width": 1100,
                      "height": 400
                    },
                    "components": [
                      {
                        "id": "invoice_service",
                        "type": "fargate",
                        "label": "Invoice Service\\nECS Fargate\\n10K facturas/hora",
                        "position": {
                          "x": 50,
                          "y": 80
                        },
                        "size": {
                          "width": 150,
                          "height": 100
                        },
                        "properties": {
                          "cpu": "4 vCPU",
                          "memory": "8 GB",
                          "replicas": 5,
                          "business_function": "Procesamiento facturas individual y lotes"
                        }
                      },
                      {
                        "id": "product_service",
                        "type": "fargate",
                        "label": "Product Service\\nECS Fargate\\n60M productos",
                        "position": {
                          "x": 250,
                          "y": 80
                        },
                        "size": {
                          "width": 150,
                          "height": 100
                        },
                        "properties": {
                          "cpu": "2 vCPU",
                          "memory": "4 GB",
                          "replicas": 3,
                          "business_function": "Gestión 60M productos migrados GCP"
                        }
                      },
                      {
                        "id": "ocr_service",
                        "type": "fargate",
                        "label": "OCR Service\\nECS Fargate\\n95% precisión",
                        "position": {
                          "x": 450,
                          "y": 80
                        },
                        "size": {
                          "width": 150,
                          "height": 100
                        },
                        "properties": {
                          "cpu": "8 vCPU",
                          "memory": "16 GB",
                          "replicas": 2,
                          "business_function": "Análisis facturas PDF/imagen"
                        }
                      },
                      {
                        "id": "commission_service",
                        "type": "fargate",
                        "label": "Commission Service\\nECS Fargate\\nDIAN Compliance",
                        "position": {
                          "x": 650,
                          "y": 80
                        },
                        "size": {
                          "width": 150,
                          "height": 100
                        },
                        "properties": {
                          "cpu": "4 vCPU",
                          "memory": "8 GB",
                          "replicas": 3,
                          "business_function": "Cálculos comisión regulatoria"
                        }
                      },
                      {
                        "id": "certificate_service",
                        "type": "fargate",
                        "label": "Certificate Service\\nECS Fargate\\nPDF Generation",
                        "position": {
                          "x": 850,
                          "y": 80
                        },
                        "size": {
                          "width": 150,
                          "height": 100
                        },
                        "properties": {
                          "cpu": "2 vCPU",
                          "memory": "4 GB",
                          "replicas": 2,
                          "business_function": "Certificados PDF DIAN compliance"
                        }
                      }
                    ]